{
  "protocol_version": "1.0",
  "run_id": "run_status_examples_expanded_01",
  "task_id": "task-browser-resume",
  "summary": "Resume a browser-based validation after an executor crash left ownership uncertain.",
  "status": "stale",
  "created_at": "2026-03-17T15:00:30Z",
  "updated_at": "2026-03-17T15:29:00Z",
  "trace_ids": [
    "story-layout-and-writes",
    "story-validation-artifacts",
    "sc-failure-handling",
    "ac-resume-rules-documented"
  ],
  "batch_id": "b-browser",
  "depends_on": [
    "task-local-server-smoke"
  ],
  "assigned_agent_id": "agent-browser-02",
  "assigned_executor": "executor",
  "resource_class": "browser",
  "max_parallelism": 1,
  "teardown_required": true,
  "resource_status": "unknown",
  "started_at": "2026-03-17T15:18:00Z",
  "last_heartbeat_at": "2026-03-17T15:23:00Z",
  "evidence_refs": [
    "artifacts/smoke-screenshot.png"
  ],
  "error": "Executor heartbeat expired during browser validation, so prior ownership cannot be trusted.",
  "resume_note": "Mark the attempt stale, verify the old browser profile is gone, then redispatch with a new agent_id if resume continues.",
  "agent_ref": {
    "agent_id": "agent-browser-02",
    "path": "status/agents/agent-browser-02.json"
  }
}
